{
	"_id": 131004,
	"id": "Dawncatcher",
	"name": "Atrapaauroras",
	"description": "Una subespecie de medaka con escamas relucientes. Parece ser una variación de los medakas normales, pero su apariencia y sus costumbres son muy distintas.<br/>Hay un rumor sobre la supuesta habilidad de estos peces para predecir el tiempo: si saltan del agua para rozar la primera luz del amanecer que atraviesa los cielos, será un día soleado.",
	"rarity": 3,
	"source": [
		"Pescar"
	],
	"bait": {
		"_id": 111023,
		"id": "FruitPasteBait",
		"name": "Cebo afrutado",
		"rarity": 2
	}
}